09:05:07.191966 IP 0.0.0.0.68 > 255.255.255.255.67: BOOTP/DHCP, Request from 64:4b:f0:00:04:7a, length 300
E..H......!..........D.C.4.........^....................dK...z..........................................................................................................................................................................................................c.Sc5..7
.y...w._,.9...=..dK...z3..v...	Ritas-Air...............
09:05:08.494390 ARP, Request who-has 10.1.20.220 tell 10.1.20.1, length 46
........h...L.
.........
.....................
09:05:09.035817 IP 10.1.20.138.52348 > 172.217.19.67.443: Flags [.], ack 695693916, win 2840, options [nop,nop,TS val 227648 ecr 2285075699], length 0
E..4..@.@..Z
......C.|...6.D)wr\...........
..y@.3|.
09:05:09.052207 IP 172.217.19.67.443 > 10.1.20.138.52348: Flags [.], ack 1, win 540, options [nop,nop,TS val 2285120815 ecr 205093], length 0
E..4....5.#k...C
......|)wr\.6.E....o......
.4-/..!%
09:05:09.491685 ARP, Request who-has 10.1.20.220 tell 10.1.20.1, length 46
........h...L.
.........
.....................
09:05:09.758169 ARP, Request who-has 10.1.20.122 tell 10.1.20.1, length 46
........h...L.
.........
..z..................
09:05:10.339264 IP 10.1.20.107.5353 > 224.0.0.251.5353: 0 [2q] [1au] PTR (QM)? _homekit._tcp.local. PTR (QM)? _sleep-proxy._udp.local. (90)
E..vr.....ID
..k.........b;5............._homekit._tcp.local......_sleep-proxy._udp........)................g..@..g..@
09:05:10.341865 IP6 fe80::106a:8235:dcf6:8cc3.5353 > ff02::fb.5353: 0 [2q] [1au] PTR (QM)? _homekit._tcp.local. PTR (QM)? _sleep-proxy._udp.local. (90)
`....b...........j.5.........................b?.............._homekit._tcp.local......_sleep-proxy._udp........)................g..@..g..@
09:05:10.893970 ARP, Request who-has 10.1.20.122 tell 10.1.20.1, length 46
........h...L.
.........
..z..................
09:05:11.035642 IP 10.1.20.138.52348 > 172.217.19.67.443: Flags [P.], seq 1:202, ack 1, win 2840, options [nop,nop,TS val 228147 ecr 2285120815], length 201
E.....@.@...
......C.|...6.E)wr\...........
..{3.4-/............{[.........l|.g5.'3......u.......z........k.....'t.c...v.....<..x...7.R...Rl.K2....G(.3[....(.1..pY5{.!.I..U.;..{.wx..zz.^.M......X.1.._..vJ*...?. g.s.a...Q.!.x.[...Gud.....m..j....../R..D.
09:05:11.035684 IP 10.1.20.138.52348 > 172.217.19.67.443: Flags [P.], seq 202:248, ack 1, win 2840, options [nop,nop,TS val 228147 ecr 2285120815], length 46
E..b..@.@..*
......C.|...6..)wr\...........
..{3.4-/....).......|...S.3.-.1.TUj......&%..6........
09:05:11.040588 IP 10.1.20.138.52348 > 172.217.19.67.443: Flags [P.], seq 248:290, ack 1, win 2840, options [nop,nop,TS val 228149 ecr 2285120815], length 42
E..^..@.@..-
......C.|...6.<)wr\...........
..{5.4-/....%.......}.....=>J<....!.f.o....\.u.1%.
09:05:11.052012 IP 172.217.19.67.443 > 10.1.20.138.52348: Flags [.], ack 202, win 547, options [nop,nop,TS val 2285122814 ecr 228147], length 0
E..4&...5......C
......|)wr\.6.....#.9.....
.44...{3
09:05:11.052043 IP 172.217.19.67.443 > 10.1.20.138.52348: Flags [.], ack 248, win 547, options [nop,nop,TS val 2285122814 ecr 228147], length 0
E..4....5..e...C
......|)wr\.6.<...#.......
.44...{3
09:05:11.052459 IP 172.217.19.67.443 > 10.1.20.138.52348: Flags [P.], seq 1:47, ack 248, win 547, options [nop,nop,TS val 2285122815 ecr 228147], length 46
E..bk...5.:....C
......|)wr\.6.<...#.......
.44...{3....).........m%..=. ._...'\2,...9..Q7o.<s.}..
09:05:11.091786 IP 10.1.20.138.52348 > 172.217.19.67.443: Flags [.], ack 47, win 2840, options [nop,nop,TS val 228162 ecr 2285122815], length 0
E..4..@.@..V
......C.|...6.f)wr............
..{B.44.
09:05:11.097588 IP 172.217.19.67.443 > 10.1.20.138.52348: Flags [.], ack 290, win 547, options [nop,nop,TS val 2285122819 ecr 228149], length 0
E..4.7..5......C
......|)wr..6.f...#.......
.45...{5
09:05:11.495631 ARP, Request who-has 10.1.20.220 tell 10.1.20.1, length 46
........h...L.
.........
.....................
09:05:12.186429 ARP, Request who-has 10.1.20.122 tell 10.1.20.1, length 46
........h...L.
.........
..z..................
09:05:12.648464 IP 10.1.20.138.43274 > 213.95.41.4.443: Flags [R.], seq 2959457510, ack 3268554317, win 341, options [nop,nop,TS val 228551 ecr 839691117], length 0
E..4.S@.@...
...._)..
...e.....M...U.......
..|.2..m
09:05:12.648551 IP 10.1.20.138.43271 > 213.95.41.4.443: Flags [R.], seq 2925356513, ack 3580593488, win 816, options [nop,nop,TS val 228551 ecr 839691117], length 0
E..4C.@.@..D
...._)......]e..k.P...0.......
..|.2..m
09:05:12.648601 IP 10.1.20.138.43273 > 213.95.41.4.443: Flags [R.], seq 3897950478, ack 1153766671, win 725, options [nop,nop,TS val 228551 ecr 839691117], length 0
E..4..@.@.AB
...._)..	...V..D..............
..|.2..m
09:05:12.648644 IP 10.1.20.138.43272 > 213.95.41.4.443: Flags [R.], seq 2106263768, ack 880256136, win 929, options [nop,nop,TS val 228551 ecr 839691117], length 0
E..4$f@.@..o
...._).....}...4w.............
..|.2..m
09:05:12.648685 IP 10.1.20.138.43270 > 213.95.41.4.443: Flags [R.], seq 3149585340, ack 2219311783, win 341, options [nop,nop,TS val 228551 ecr 839691092], length 0
E..4.T@.@.$.
...._)..........H.....U.......
..|.2..T
09:05:12.648725 IP 10.1.20.138.43269 > 213.95.41.4.443: Flags [R.], seq 403582641, ack 3498665655, win 703, options [nop,nop,TS val 228551 ecr 839691100], length 0
E..4
5@.@...
...._)...........f............
..|.2..\
09:05:12.648761 IP 10.1.20.138.43268 > 213.95.41.4.443: Flags [R.], seq 2608444586, ack 55092365, win 839, options [nop,nop,TS val 228551 ecr 839691053], length 0
E..4..@.@..O
...._)......y...H.....G.......
..|.2..-
09:05:12.649051 IP 127.0.0.1.33788 > 127.0.1.1.53: 11388+ A? www.youtube.com. (33)
E..=..@.@.o............5.).<,|...........www.youtube.com.....
09:05:12.649126 IP 10.1.20.138.5625 > 10.1.20.1.53: 12363+ A? www.youtube.com. (33)
E..=.N@.@...
...
......5.)<.0K...........www.youtube.com.....
09:05:12.649143 IP 10.8.0.167.5625 > 10.8.0.2.53: 12363+ A? www.youtube.com. (33)
E..=w.@.@..C
...
......5.)e.0K...........www.youtube.com.....
09:05:12.649200 IP 127.0.0.1.36077 > 127.0.1.1.53: 5293+ A? clients1.google.com. (37)
E..A..@.@.o............5.-.@.............clients1.google.com.....
09:05:12.649245 IP 10.1.20.138.21735 > 10.1.20.1.53: 12299+ A? clients1.google.com. (37)
E..A.O@.@...
...
...T..5.-<.0............clients1.google.com.....
09:05:12.649432 IP 127.0.0.1.49691 > 127.0.1.1.53: 59582+ A? fonts.googleapis.com. (38)
E..B..@.@.o............5...A.............fonts
googleapis.com.....
09:05:12.649476 IP 10.1.20.138.14082 > 10.1.20.1.53: 50200+ A? fonts.googleapis.com. (38)
E..B.P@.@...
...
...7..5..<..............fonts
googleapis.com.....
09:05:12.649606 IP 127.0.0.1.37459 > 127.0.1.1.53: 31818+ A? fonts.gstatic.com. (35)
E..?..@.@.o..........S.5.+.>|J...........fonts.gstatic.com.....
09:05:12.649649 IP 10.1.20.138.19642 > 10.1.20.1.53: 26868+ A? fonts.gstatic.com. (35)
E..?.Q@.@...
...
...L..5.+<.h............fonts.gstatic.com.....
09:05:12.649768 IP 10.1.20.1.53 > 10.1.20.138.21735: 12299 2/0/0 CNAME clients.l.google.com., A 172.217.22.78 (77)
E..i....@..Z
...
....5T..U..0............clients1.google.com..............*...clients.l...1.............N
09:05:12.649815 IP 127.0.1.1.53 > 127.0.0.1.36077: 5293 2/0/0 CNAME clients.l.google.com., A 172.217.22.78 (77)
E..i.r@.@............5...U.h.............clients1.google.com..............*...clients.l...1.............N
09:05:12.649903 IP 127.0.0.1.60174 > 127.0.1.1.53: 12490+ A? googleads.g.doubleclick.net. (45)
E..I..@.@.o............5.5.H0...........	googleads.g.doubleclick.net.....
09:05:12.649937 IP 10.1.20.1.53 > 10.1.20.138.19642: 26868 2/0/0 CNAME gstaticadssl.l.google.com., A 172.217.22.67 (87)
E..swg..@...
...
....5L.._.0h............fonts.gstatic.com..................gstaticadssl.l.google.../.............C
09:05:12.649971 IP 10.1.20.138.12519 > 10.1.20.1.53: 62711+ A? googleads.g.doubleclick.net. (45)
E..I.R@.@...
...
...0..5.5<.............	googleads.g.doubleclick.net.....
09:05:12.649988 IP 127.0.0.1.50271 > 127.0.1.1.53: 58325+ A? i.ytimg.com. (29)
E..9..@.@.o.........._.5.%.8.............i.ytimg.com.....
09:05:12.649998 IP 127.0.1.1.53 > 127.0.0.1.37459: 31818 2/0/0 CNAME gstaticadssl.l.google.com., A 172.217.22.67 (87)
E..s.s@.@............5.S._.r|J...........fonts.gstatic.com..................gstaticadssl.l.google.../.............C
09:05:12.650041 IP 10.1.20.138.52716 > 10.1.20.1.53: 61247+ A? i.ytimg.com. (29)
E..9.S@.@...
...
......5.%<..?...........i.ytimg.com.....
09:05:12.650297 IP 10.1.20.1.53 > 10.1.20.138.12519: 62711 2/0/0 CNAME pagead46.l.doubleclick.net., A 172.217.22.34 (86)
E..rHm..@...
...
....50..^..............	googleads.g.doubleclick.net..................pagead46.l...9............."
09:05:12.650309 IP 10.1.20.1.53 > 10.1.20.138.52716: 61247 17/0/0 CNAME ytimg.l.google.com., A 216.58.206.14, A 216.58.207.78, A 216.58.214.78, A 172.217.16.174, A 216.58.208.46, A 172.217.22.78, A 172.217.22.110, A 216.58.214.110, A 172.217.16.206, A 216.58.210.14, A 172.217.23.174, A 172.217.21.206, A 216.58.205.238, A 172.217.21.238, A 172.217.22.14, A 172.217.18.14 (314)
E..V.|..@.y.
...
....5...B.l.?...........i.ytimg.com..................ytimg.l.google...)...........:...)...........:.N.)...........:.N.)...............)...........:...).............N.).............n.)...........:.n.)...............)...........:...)...............)...............)...........:...)...............)...............)..............
09:05:12.650354 IP 127.0.1.1.53 > 127.0.0.1.60174: 12490 2/0/0 CNAME pagead46.l.doubleclick.net., A 172.217.22.34 (86)
E..r.t@.@............5...^.q0...........	googleads.g.doubleclick.net..................pagead46.l...9............."
09:05:12.650383 IP 127.0.1.1.53 > 127.0.0.1.50271: 58325 17/0/0 CNAME ytimg.l.google.com., A 216.58.206.14, A 216.58.207.78, A 216.58.214.78, A 172.217.16.174, A 216.58.208.46, A 172.217.22.78, A 172.217.22.110, A 216.58.214.110, A 172.217.16.206, A 216.58.210.14, A 172.217.23.174, A 172.217.21.206, A 216.58.205.238, A 172.217.21.238, A 172.217.22.14, A 172.217.18.14 (314)
E..V.u@.@............5._.B.V.............i.ytimg.com..................ytimg.l.google...)...........:...)...........:.N.)...........:.N.)...............)...........:...).............N.).............n.)...........:.n.)...............)...........:...)...............)...............)...........:...)...............)...............)..............
09:05:12.650787 IP 10.1.20.138.58640 > 172.217.22.78.443: Flags [S], seq 2357448698, win 29200, options [mss 1460,sackOK,TS val 228551 ecr 0,nop,wscale 7], length 0
E..<.=@.@...
......N..............r............
..|.........
09:05:12.650874 IP 127.0.0.1.55949 > 127.0.1.1.53: 34714+ A? s.ytimg.com. (29)
E..9..@.@.o............5.%.8.............s.ytimg.com.....
09:05:12.650942 IP 10.1.20.138.55448 > 172.217.22.67.443: Flags [S], seq 2590729198, win 29200, options [mss 1460,sackOK,TS val 228551 ecr 0,nop,wscale 7], length 0
E..<.)@.@.9.
......C.....kc.......r............
..|.........
09:05:12.650952 IP 10.1.20.138.34637 > 10.1.20.1.53: 3917+ A? s.ytimg.com. (29)
E..9.T@.@...
...
....M.5.%<..M...........s.ytimg.com.....
09:05:12.651057 IP 10.1.20.138.34858 > 172.217.22.34.443: Flags [S], seq 2814662833, win 29200, options [mss 1460,sackOK,TS val 228551 ecr 0,nop,wscale 7], length 0
E..<$v@.@.4.
......".*....X.......r............
..|.........
09:05:12.651096 IP 127.0.0.1.47576 > 127.0.1.1.53: 43640+ A? www.google.com. (32)
E..<..@.@.o............5.(.;.x...........www.google.com.....
09:05:12.651139 IP 127.0.0.1.33391 > 127.0.1.1.53: 39697+ A? www.gstatic.com. (33)
E..=..@.@.o..........o.5.).<.............www.gstatic.com.....
09:05:12.651149 IP 10.1.20.138.30317 > 10.1.20.1.53: 12952+ A? www.google.com. (32)
E..<.U@.@...
...
...vm.5.(<.2............www.google.com.....
09:05:12.651155 IP 10.1.20.138.57023 > 216.58.206.14.443: Flags [S], seq 653099861, win 29200, options [mss 1460,sackOK,TS val 228551 ecr 0,nop,wscale 7], length 0
E..<..@.@.vU
....:......&..U......r............
..|.........
09:05:12.651179 IP 10.1.20.138.46074 > 10.1.20.1.53: 36142+ A? www.gstatic.com. (33)
E..=.V@.@...
...
......5.)<..............www.gstatic.com.....
09:05:12.651427 IP 10.1.20.1.53 > 10.1.20.138.30317: 12952 1/0/0 A 172.217.19.68 (48)
E..L....@.lT
...
....5vm.8.@2............www.google.com....................D
09:05:12.651475 IP 127.0.1.1.53 > 127.0.0.1.47576: 43640 1/0/0 A 172.217.19.68 (48)
E..L.v@.@..(.........5...8.K.x...........www.google.com....................D
09:05:12.651487 IP 10.1.20.1.53 > 10.1.20.138.46074: 36142 1/0/0 A 172.217.22.67 (49)
E..M"...@..K
...
....5...9...............www.gstatic.com....................C
09:05:12.651514 IP 127.0.1.1.53 > 127.0.0.1.33391: 39697 1/0/0 A 172.217.22.67 (49)
E..M.w@.@..&.........5.o.9.L.............www.gstatic.com....................C
09:05:12.652003 IP 10.1.20.138.55170 > 172.217.19.68.443: Flags [S], seq 3525266118, win 29200, options [mss 1460,sackOK,TS val 228552 ecr 0,nop,wscale 7], length 0
E..<6.@.@.&.
......D......J.......r............
..|.........
09:05:12.652075 IP 10.1.20.138.55452 > 172.217.22.67.443: Flags [S], seq 374164809, win 29200, options [mss 1460,sackOK,TS val 228552 ecr 0,nop,wscale 7], length 0
E..<1.@.@.'.
......C.....MMI......r............
..|.........
09:05:12.655729 IP 172.217.22.78.443 > 10.1.20.138.58640: Flags [S.], seq 2382719800, ack 2357448699, win 42408, options [mss 1380,sackOK,TS val 3255562324 ecr 228551,nop,wscale 8], length 0
E..<0...;.m....N
.........k8........U0.....d...
...T..|.....
09:05:12.655818 IP 10.1.20.138.58640 > 172.217.22.78.443: Flags [.], ack 1, win 229, options [nop,nop,TS val 228553 ecr 3255562324], length 0
E..4.>@.@...
......N..........k9...........
..|....T
09:05:12.655834 IP 216.58.206.14.443 > 10.1.20.138.57023: Flags [S.], seq 365065954, ack 653099862, win 42408, options [mss 1380,sackOK,TS val 4146303436 ecr 228551,nop,wscale 8], length 0
E..<....;....:..
.........v.&..V...........d...
.#....|.....
09:05:12.655845 IP 10.1.20.138.57023 > 216.58.206.14.443: Flags [.], ack 1, win 229, options [nop,nop,TS val 228553 ecr 4146303436], length 0
E..4..@.@.v\
....:......&..V..v............
..|..#..
09:05:12.655849 IP 172.217.22.67.443 > 10.1.20.138.55448: Flags [S.], seq 2698569440, ack 2590729199, win 42408, options [mss 1380,sackOK,TS val 1040769841 ecr 228551,nop,wscale 8], length 0
E..<....;..W...C
............kc............d...
>..1..|.....
09:05:12.655854 IP 10.1.20.138.55448 > 172.217.22.67.443: Flags [.], ack 1, win 229, options [nop,nop,TS val 228553 ecr 1040769841], length 0
E..4.*@.@.9.
......C.....kc................
..|.>..1
09:05:12.656084 IP 172.217.22.34.443 > 10.1.20.138.34858: Flags [S.], seq 1905497532, ack 2814662834, win 42408, options [mss 1380,sackOK,TS val 1301434251 ecr 228551,nop,wscale 8], length 0
E..<....;..Z..."
......*q.....X......|.....d...
M.O...|.....
09:05:12.656108 IP 10.1.20.138.34858 > 172.217.22.34.443: Flags [.], ack 1, win 229, options [nop,nop,TS val 228553 ecr 1301434251], length 0
E..4$w@.@.4.
......".*....X.q..............
..|.M.O.
09:05:12.656173 IP 10.1.20.138.58640 > 172.217.22.78.443: Flags [P.], seq 1:518, ack 1, win 229, options [nop,nop,TS val 228553 ecr 3255562324], length 517
E..9.?@.@...
......N..........k9...........
..|....T...........JW}..I.. ..1.c.~wOB].M~.F.J.3J.. ..j..Nb.. .P+..67........$6.@.....JJ.+./.,.0............./.5.
....zz................clients1.google.com.....#...A.7 &..+...k.t.>...a}$...!.=...{UO..3.L....z..H...Fc(.Kx......c..n.|.nf!K.U.......g....-.N....!H...r4..!..i2...k........t...M....#..A....w'.8...,.[..v...=.c.a..o..U.rNvuB.K.\YTy....(oA.H..".....=......~..b....aN.!	G..".$V~..#Y.y.+...e.f(N.8.....'5.v..z..............................................h2.http/1.1uP.........
.
..ZZ..................................
09:05:12.656296 IP 10.1.20.138.57023 > 216.58.206.14.443: Flags [P.], seq 1:518, ack 1, win 229, options [nop,nop,TS val 228553 ecr 4146303436], length 517
E..9..@.@.tV
....:......&..V..v............
..|..#...............RG1..AV..B.R..%..8.....Y....w. &.P...H.P.3)C.v..j+C.).{...... Z.....+./.,.0............./.5.
....ZZ................i.ytimg.com.....#...A.7 &..+...k.t........N5..b.j.-.._d....S..g..-^.....'&.K.;*.....ff...&c.!o.J......?.......1...0*xw...:...@.^}.j....VR&_..X@....A%.04r.).?.pw~.S^]{.5.......Hl.H2..E..C.3......\.'*....{+....J.2HO..!A?......C.g%.o49G...:..6m&...G.S..z.0R-.......	.Ed....g...............................................h2.http/1.1uP.........
.
..........JJ..................................
09:05:12.656361 IP 10.1.20.138.55448 > 172.217.22.67.443: Flags [P.], seq 1:206, ack 1, win 229, options [nop,nop,TS val 228553 ecr 1040769841], length 205
E....+@.@.9%
......C.....kc................
..|.>..1..............:	.!C.t.'.+Y....g.l.....Sb.f.......+./.,.0............./.5.
......................fonts.gstatic.com.....#..............................................h2.http/1.1uP.........
.
..........::...
09:05:12.656424 IP 10.1.20.138.34858 > 172.217.22.34.443: Flags [P.], seq 1:518, ack 1, win 229, options [nop,nop,TS val 228553 ecr 1301434251], length 517
E..9$x@.@.2.
......".*....X.q..............
..|.M.O............p-'j..?...........A.o...E..R.._. .	+s...o.)TF....B...E...#S....Y...zz.+./.,.0............./.5.
....**.......... .....googleads.g.doubleclick.net.....#...A.7 &..+...k.t..n=.&o\.....g.....v.9D ..9<n..7
.<5...`......z...........r......3..X7.......-*.PE.m5...qT.:I*-...Y../..[}..K..`C.D...9..#u.....?....NzOC.Zf.._,..5.+?.QV.3^..;^..h......!D.B..j.........+...	..5.<z....._.. ,.h.;[M..u.
.p... 
..f..0.>...6..E.............................................h2.http/1.1uP.........
.
..**......jj..................
09:05:12.657111 IP 172.217.22.67.443 > 10.1.20.138.55452: Flags [S.], seq 2783571831, ack 374164810, win 42408, options [mss 1380,sackOK,TS val 3947802872 ecr 228552,nop,wscale 8], length 0
E..<Jv..;.S....C
..........w.MMJ...........d...
.N....|.....
09:05:12.657121 IP 10.1.20.138.55452 > 172.217.22.67.443: Flags [.], ack 1, win 229, options [nop,nop,TS val 228553 ecr 3947802872], length 0
E..41.@.@.'.
......C.....MMJ...x...........
..|..N..
09:05:12.657224 IP 10.1.20.138.55452 > 172.217.22.67.443: Flags [P.], seq 1:518, ack 1, win 229, options [nop,nop,TS val 228553 ecr 3947802872], length 517
E..91.@.@.%.
......C.....MMJ...x...........
..|..N.............}, k...9.o{.....,..{...RUJ..j..3 .q...d]?./X....pM....Y.H4.z.q.f...zz.+./.,.0............./.5.
....**................www.gstatic.com.....#...A.7 &..+...k.t.).w!(@....6u.Mt?...AW5....&...qh....v.u.o\Qmw....a.........*....l......J.#X..............b.Y...
.......:...4..^.......w^Rm.|2...F2M1..........>=C...zM."~Uq0Z/.9t.L.,.pF..;+.0s......E.q.=w.....|.......v.'..J.`..Y...1..8..m.7~....|<:E....f.t............................................h2.http/1.1uP.........
.
..**......jj..............................
09:05:12.660980 IP 216.58.206.14.443 > 10.1.20.138.57023: Flags [.], ack 518, win 170, options [nop,nop,TS val 4146303442 ecr 228553], length 0
E..4:c..;....:..
.........v.&..[...........
.#....|.
09:05:12.661350 IP 172.217.22.78.443 > 10.1.20.138.58640: Flags [.], ack 518, win 170, options [nop,nop,TS val 3255562330 ecr 228553], length 0
E..4.;..;......N
.........k9........&......
...Z..|.
09:05:12.661356 IP 172.217.22.67.443 > 10.1.20.138.55448: Flags [.], ack 206, win 170, options [nop,nop,TS val 1040769847 ecr 228553], length 0
E..4....;......C
............kd......).....
>..7..|.
09:05:12.661359 IP 172.217.22.34.443 > 10.1.20.138.34858: Flags [.], ack 518, win 170, options [nop,nop,TS val 1301434256 ecr 228553], length 0
E..4p#..;......"
......*q.....Z............
M.O...|.
09:05:12.661362 IP 216.58.206.14.443 > 10.1.20.138.57023: Flags [P.], seq 1:161, ack 518, win 170, options [nop,nop,TS val 4146303442 ecr 228553], length 160
E.......;....:..
.........v.&..[...........
.#....|.....h...d..Z.y....o.M.
..iVg.)p.'$.|&..xM.. &.P...H.P.3)C.v..j+C.).{...... Z.+...................h2uP..................(...........!I..8N.c..c.8fX.?8...l..q...h
09:05:12.661367 IP 10.1.20.138.57023 > 216.58.206.14.443: Flags [.], ack 161, win 237, options [nop,nop,TS val 228554 ecr 4146303442], length 0
E..4..@.@.vZ
....:......&..[..w............
..|..#..
09:05:12.661476 IP 10.1.20.1.53 > 10.1.20.138.14082: 50200 2/0/0 CNAME googleadapis.l.google.com., A 172.217.22.74 (90)
E..v(...@...
...
....57..b...............fonts
googleapis.com..................googleadapis.l.google...2.......,.....J
09:05:12.661555 IP 127.0.1.1.53 > 127.0.0.1.49691: 59582 2/0/0 CNAME googleadapis.l.google.com., A 172.217.22.74 (90)
E..v.z@.@............5...b.u.............fonts
googleapis.com..................googleadapis.l.google...2.......,.....J
09:05:12.661574 IP 172.217.22.34.443 > 10.1.20.138.34858: Flags [P.], seq 1:161, ack 518, win 170, options [nop,nop,TS val 1301434256 ecr 228553], length 160
E....*..;..s..."
......*q.....Z......;.....
M.O...|.....h...d..Z.y.?$.#..Q...~....55o...T9.T.u. .	+s...o.)TF....B...E...#S....Y..+...................h2uP..................(........#........dL~.......+D.%.D.|H....
09:05:12.661587 IP 10.1.20.138.34858 > 172.217.22.34.443: Flags [.], ack 161, win 237, options [nop,nop,TS val 228554 ecr 1301434256], length 0
E..4$y@.@.4.
......".*....Z.q..]...........
..|.M.O.
09:05:12.661816 IP 172.217.22.78.443 > 10.1.20.138.58640: Flags [P.], seq 1:161, ack 518, win 170, options [nop,nop,TS val 3255562330 ecr 228553], length 160
E.......;......N
.........k9...............
...Z..|.....h...d..Z.y.a..Q.....e1...E1c).;.....`.. ..j..Nb.. .P+..67........$6.@....+...................h2uP..................(........:L...4.......l`#..........>.....
09:05:12.661827 IP 10.1.20.138.58640 > 172.217.22.78.443: Flags [.], ack 161, win 237, options [nop,nop,TS val 228554 ecr 3255562330], length 0
E..4.@@.@...
......N..........k............
..|....Z
09:05:12.661841 IP 10.1.20.138.57023 > 216.58.206.14.443: Flags [P.], seq 518:734, ack 161, win 237, options [nop,nop,TS val 228554 ecr 4146303442], length 216
E.....@.@.u.
....:......&..[..w............
..|..#.....................C6..._.
E.........LN?{.....fp`...#R..>..../.n...5.
....^...j.i...M.....5.i....p8^.....4.:UF..Q.&.aY.Z.<..V.$~..............1..m....A_	.w..{.u..i.U..i@.x....(........	.z.b..4..m.n.......c0..{W..._./
09:05:12.662315 IP 172.217.22.67.443 > 10.1.20.138.55452: Flags [.], ack 518, win 170, options [nop,nop,TS val 3947802877 ecr 228553], length 0
E..4X>..;.E....C
..........x.MOO...........
.N....|.
09:05:12.662804 IP 172.217.22.67.443 > 10.1.20.138.55452: Flags [P.], seq 1:161, ack 518, win 170, options [nop,nop,TS val 3947802878 ecr 228553], length 160
E.......;......C
..........x.MOO...........
.N....|.....h...d..Z.y...[A.ow..W.-.X&@sq..g.....*8 .q...d]?./X....pM....Y.H4.z.q.f..+...................h2uP..................(..........Z.v.b
.)
r..i...w...o..q......
09:05:12.662809 IP 10.1.20.138.55452 > 172.217.22.67.443: Flags [.], ack 161, win 237, options [nop,nop,TS val 228554 ecr 3947802878], length 0
E..41.@.@.'.
......C.....MOO...............
..|..N..
09:05:12.663322 IP 10.1.20.1.53 > 10.1.20.138.34637: 3917 2/0/0 CNAME ytstatic.l.google.com., A 172.217.22.78 (77)
E..i....@..b
...
....5.M.U.X.M...........s.ytimg.com..................ytstatic.l.google...).......,.....N
09:05:12.663373 IP 127.0.1.1.53 > 127.0.0.1.55949: 34714 2/0/0 CNAME ytstatic.l.google.com., A 172.217.22.78 (77)
E..i.{@.@............5...U.h.............s.ytimg.com..................ytstatic.l.google...).......,.....N
09:05:12.664587 IP 10.1.20.138.56864 > 172.217.22.74.443: Flags [S], seq 2676307004, win 29200, options [mss 1460,sackOK,TS val 228555 ecr 0,nop,wscale 7], length 0
E..<H.@.@...
......J. ....4<......r............
..|.........
09:05:12.665209 IP 10.1.20.138.34858 > 172.217.22.34.443: Flags [P.], seq 518:734, ack 161, win 237, options [nop,nop,TS val 228555 ecr 1301434256], length 216
E...$z@.@.3.
......".*....Z.q..]...........
..|.M.O....................?...!.F.1....<[.?iLP....hM..-g...........'.....>..c#.KZ.5...f[".J.....}.........2....W.a
....F......rwZ. .YW<..t+..o...g.Y....u.@...6N.D1%-}.;.A.)b..i......(........V.ee.H\V..........&.<J.{.sU...5.
09:05:12.667077 IP 216.58.206.14.443 > 10.1.20.138.57023: Flags [P.], seq 161:230, ack 734, win 175, options [nop,nop,TS val 4146303448 ecr 228554], length 69
E..y....;.3..:..
.........w.&..3...........
.#....|.....@........PP..pTT......:.A.DwD...D../GU.N..3.^'.......{.........4.
09:05:12.667342 IP 10.1.20.138.58647 > 172.217.22.78.443: Flags [S], seq 3599326968, win 29200, options [mss 1460,sackOK,TS val 228555 ecr 0,nop,wscale 7], length 0
E..<"3@.@.6.
......N......^.......r............
..|.........
09:05:12.667929 IP 10.1.20.138.58640 > 172.217.22.78.443: Flags [P.], seq 518:734, ack 161, win 237, options [nop,nop,TS val 228556 ecr 3255562330], length 216
E....A@.@...
......N..........k............
..|....Z......................5|.....Z!D.....h.V...7.V....+.....2mKl..........z.a=B|..RN.F.......x<.&/..|Q..m.}.0P..Q..{H4..W4mX.3...j..s...!....W....&e..-.....p3...n\.... /L.
.......(........lf.!....et..{.n<...`D......@c.Z.
09:05:12.668316 IP 172.217.19.68.443 > 10.1.20.138.55170: Flags [S.], seq 3628142153, ack 3525266119, win 42408, options [mss 1380,sackOK,TS val 3657114440 ecr 228552,nop,wscale 8], length 0
E..<....5."e...D
........A.I..J.....m/.....d...
..#H..|.....
09:05:12.668364 IP 10.1.20.138.55170 > 172.217.19.68.443: Flags [.], ack 1, win 229, options [nop,nop,TS val 228556 ecr 3657114440], length 0
E..46.@.@.&
......D......J..A.J...........
..|...#H
09:05:12.668813 IP 172.217.22.67.443 > 10.1.20.138.55448: Flags [.], seq 1:1419, ack 206, win 170, options [nop,nop,TS val 1040769854 ecr 228553], length 1418
E....1..;..a...C
............kd......j.....
>..>..|.....C...?..Z.y.M.G...:.....mJ.......F.....A..+.............#.........w...	...X......gp
<5.......w.........aF~.......H0F.!....k...,.....R.O.:..>....m.9eeA..!..i.	.....V.'..Oy...#.....'.>.....v....+z.O. ....hp~.....\..=..........aF~.......G0E.!..^...N........u..6!..Kw.J.....Xu. n...g. ..0"..4..z`X...K...._F.B........h2uP............D...@..=...0...0..k.......B.......0..	*.H........0I1.0	..U....US1.0...U.
.
Google Inc1%0#..U....Google Internet Authority G20...180130083045Z..180424083000Z0f1.0	..U....US1.0...U...
California1.0...U....Mountain View1.0...U.
.
Google Inc1.0...U....*.google.com0Y0...*.H.=....*.H.=....B..}.....$..H8..w..6I.qU.;x.S.S."X8......4..?'....c..v.....j.a...E8....0...0...U.%..0
..+.......0...U...........0.....U......0.....*.google.com..*.android.com..*.appengine.google.com..*.cloud.google.com..*.db833953.google.cn..*.g.co..*.gcp.gvt2.com..*.google-analytics.com..*.google.ca..*.google.cl..*.google.co.in..*.google.co.jp..*.google.co.uk..*.google.com.ar..*.google.com.au..*.google.com.br..*.google.com.co..*.google.com.mx..*.google.com.tr..*.google.com.vn..*.google.de..*.google.es..*.google.fr..*.google.hu..*.google.it..*.google.nl..*.google.pl..*.google.pt..*.googleadapis.com..*.googleapis.cn..*.googlecommerce.com..*.googlevideo.com..*.gstatic.cn..*.gstatic.com.
*.gvt1.com.
*.gvt2.com..*.metric.gstatic.com..*.urchin.com..*.url.google.com..*.youtube-nocookie.com..*.youtube.com..*.youtu
09:05:12.668832 IP 10.1.20.138.55448 > 172.217.22.67.443: Flags [.], ack 1419, win 251, options [nop,nop,TS val 228556 ecr 1040769854], length 0
E..4.,@.@.9.
......C.....kd....k...........
..|.>..>
09:05:12.668838 IP 172.217.22.67.443 > 10.1.20.138.55448: Flags [.], seq 1419:2837, ack 206, win 170, options [nop,nop,TS val 1040769854 ecr 228553], length 1418
E....W..;..<...C
..........k.kd............
>..>..|.beeducation.com..*.yt.be..*.ytimg.com..android.clients.google.com..android.com..developer.android.google.cn..developers.android.google.cn..g.co..goo.gl..google-analytics.com.
google.com..googlecommerce.com..source.android.google.cn.
urchin.com.
www.goo.gl..youtu.be..youtube.com..youtubeeducation.com..yt.be0h..+........\0Z0+..+.....0...http://pki.google.com/GIAG2.crt0+..+.....0...http://clients1.google.com/ocsp0...U.......'.gD%.i:.h.\.....q.0...U.......0.0...U.#..0...J......h.v....b..Z./0!..U. ..0.0..
+.....y...0...g.....00..U...)0'0%.#.!..http://pki.google.com/GIAG2.crl0..	*.H................rz...c..../#.tI..........{.....%{.X...'...^.O..<Y}..jR.....`.?.y>..W@L..Vq99n.W..b}.......r..n5...@.Rte.......'	.6...$...........+Tix._.Q.......Yk.....O..8...m.L.M%.e.....h..M.j..k...%....-BFJ..B)........M..x.}.`$.5.
.M.oJ '..(..R0....X....s..).BD.m..WO..,0..(0............!%...Y.w..{f'.0..	*.H........0B1.0	..U....US1.0...U.
..GeoTrust Inc.1.0...U....GeoTrust Global CA0...170522113237Z..181231235959Z0I1.0	..U....US1.0...U.
.
Google Inc1%0#..U....Google Internet Authority G20.."0..	*.H.............0..
......*.w\.P.:.....PH..?..p..F~......!.Z.a..2D..t.SOU...b...Y_......^.?.[H8.S.$........S..J..T.}..ko...P.(0.@..sQl..:<.7...K...}$....1q...`..J.B....j...S..K....a....>c+.5ie....F".S....J..*... ..9.....az.%.NRu........"j.N.F....~...{.E3..>q...%%..5......y..7...ri.........0...0...U.#..0....z.h.....d..}.}e...N0...U..
09:05:12.668847 IP 10.1.20.138.55448 > 172.217.22.67.443: Flags [.], ack 2837, win 274, options [nop,nop,TS val 228556 ecr 1040769854], length 0
E..4.-@.@.9.
......C.....kd................
..|.>..>
09:05:12.668851 IP 172.217.22.67.443 > 10.1.20.138.55448: Flags [.], seq 2837:4255, ack 206, win 170, options [nop,nop,TS val 1040769854 ecr 228553], length 1418
E...
x..;......C
............kd.....g$.....
>..>..|.....J......h.v....b..Z./0...U...........0...+........"0 0...+.....0...http://g.symcd.com0...U.......0.......05..U....0,0*.(.&.$http://g.symcb.com/crls/gtglobal.crl0!..U. ..0.0..
+.....y...0...g.....0...U.%..0...+.........+.......0..	*.H..............I...ddw[.q....#..icT_.L..(#df.....d_..&...
p...=.{3......p..&y.......e4.<.?...o.~.zp\L.-....-..........?..w.:g6...'.rC..n..G.q>.Y..........x5/.....|..V..g.Q'0`.bR.7.;..*.8...p..z.......#2....{..;/.....L.D.!d....0.&.X.9.8...H.
Gf..._..p....y+.e2...1.
...2....0..}0.............0..	*.H........0N1.0	..U....US1.0...U.
..Equifax1-0+..U...$Equifax Secure Certificate Authority0...020521040000Z..180821040000Z0B1.0	..U....US1.0...U.
..GeoTrust Inc.1.0...U....GeoTrust Global CA0.."0..	*.H.............0..
........c0...#.V~[.<l8.q.x.....L..C...M!....X/f9)..x..8...j~q...`......(..%..........B.5....F..O...C...W-P..-.zW..._k........5..F.{r....U+...>.&d.....q.N...{...U....^8S.\O.-.P#6.f....9.....9....8......M>o....,..`9..6S.9.^&+.=...2...(R.q..3=.8..6.b.y..0._.+.qk..........0..0...U.#..0...H.h.+....G.# .O3....0...U.......z.h.....d..}.}e...N0...U.......0....0...U...........0:..U...3010/.-.+.)http://crl.geotrust.com/crls/secureca.crl0N..U. .G0E0C..U. .0;09..+........-https://www.geotrust.com/resources/repository0..	*.H............v..nNK...0.........q~f....;.....N.C8..0}..U..j.6...Hf.m....G..Z\s....2.8..4.........I......6..Vo...sc...{>".=.._8t...PN....a..?.....t...p... 
09:05:12.668856 IP 10.1.20.138.55448 > 172.217.22.67.443: Flags [.], ack 4255, win 296, options [nop,nop,TS val 228556 ecr 1040769854], length 0
E..4..@.@.9.
......C.....kd........(.......
..|.>..>
09:05:12.668859 IP 172.217.22.67.443 > 10.1.20.138.55448: Flags [P.], seq 4255:4372, ack 206, win 170, options [nop,nop,TS val 1040769854 ecr 228553], length 117
E...[b..;.BF...C
............kd............
>..>..|.... ...OC..Pb..ZZ.......{[.R...2...H0F.!..`./..J..Q.%e6^..p.wn....c@.s..s.!...\.QMd}W.<E.C.L........v..,.n_..........
09:05:12.668862 IP 10.1.20.138.55448 > 172.217.22.67.443: Flags [.], ack 4372, win 296, options [nop,nop,TS val 228556 ecr 1040769854], length 0
E..4./@.@.9.
......C.....kd........(.......
..|.>..>
09:05:12.669751 IP 172.217.22.74.443 > 10.1.20.138.56864: Flags [S.], seq 2359703188, ack 2676307005, win 42408, options [mss 1380,sackOK,TS val 1092558947 ecr 228555,nop,wscale 8], length 0
E..<.b..;......J
...... ..6...4=....k......d...
A. c..|.....
09:05:12.669770 IP 10.1.20.138.56864 > 172.217.22.74.443: Flags [.], ack 1, win 229, options [nop,nop,TS val 228556 ecr 1092558947], length 0
E..4H.@.@...
......J. ....4=..6............
..|.A. c
09:05:12.670485 IP 172.217.22.34.443 > 10.1.20.138.34858: Flags [P.], seq 161:230, ack 734, win 175, options [nop,nop,TS val 1301434265 ecr 228555], length 69
E..y....;..-..."
......*q..]..[.....i'.....
M.O...|.....@............[):U.....%.e...	...n0F....	."......).w$...........u.
09:05:12.670686 IP 10.1.20.138.55452 > 172.217.22.67.443: Flags [P.], seq 518:734, ack 161, win 237, options [nop,nop,TS val 228556 ecr 3947802878], length 216
E...1.@.@.&.
......C.....MOO...............
..|..N......................w.K..X....."......2.t.....ieB!8G....Q.'K9X.}...S...z\.5..G..w...h.	..+...E.....@.'Q`.;Xr..H.......Ykg.=....7...wZ..29a..{.M..j....>J..kDI44=......5..`.....(.........B..c...d..B.;?..QY!m......9..xM
09:05:12.672294 IP 172.217.22.78.443 > 10.1.20.138.58647: Flags [S.], seq 2516129799, ack 3599326969, win 42408, options [mss 1380,sackOK,TS val 3748912954 ecr 228555,nop,wscale 8], length 0
E..<>...;._:...N
.............^............d...
.s.:..|.....
09:05:12.672312 IP 10.1.20.138.58647 > 172.217.22.78.443: Flags [.], ack 1, win 229, options [nop,nop,TS val 228557 ecr 3748912954], length 0
E..4"4@.@.6.
......N......^................
..|..s.:
09:05:12.673203 IP 172.217.22.78.443 > 10.1.20.138.58640: Flags [P.], seq 161:230, ack 734, win 175, options [nop,nop,TS val 3255562342 ecr 228556], length 69
E..yc...;.9....N
.........k.........>].....
...f..|.....@........^....<.+.qA (.;...-/p.[5a.Z-.7.E.-.2E<....o.c...h4/d..9w
09:05:12.673490 IP 10.1.20.138.55448 > 172.217.22.67.443: Flags [P.], seq 206:464, ack 4372, win 296, options [nop,nop,TS val 228557 ecr 1040769854], length 258
E..6.0@.@.8.
......C.....kd........(.......
..|.>..>....%...! ../..Z.....wOA.v.....*.:..-..H.G....................P+.*	.~...........'.&-.9..1.kV..(d{..../V.w....i.....x.......k....5..z.?...UQW..'.!....,$...W.....Q....K........b..QyC/yw-?........(........n.H....n.t.....(.........q....%On. .nWa"/..].4,...=...	.
09:05:12.674670 IP 10.1.20.138.55170 > 172.217.19.68.443: Flags [P.], seq 1:518, ack 1, win 229, options [nop,nop,TS val 228557 ecr 3657114440], length 517
E..96.@.@.$.
......D......J..A.J...........
..|...#H...........3..)..#x.f..y...I.3+.P...).b(IM. .....B...~.........,.r....DP...p..::.+./.,.0............./.5.
......................www.google.com.....#...A.7 &..+...k.t.{.2p*i3Z..}x....E..|..c.&.:.E=lf.....3....W.c.l.U.)....t.....d..K%.(.m=.-2.U...MSJ..g6
...	`VL[g.......i.,......A.D.#*...Q..^..8.'.b._...2}Yju.....^...Z.8..D.....7.....,O.>.>......._q..F c....~w.P...=O....(..'xC..{.).k..;....R.......h.I..o............................................h2.http/1.1uP.........
.
..........**...............................
09:05:12.674743 IP 10.1.20.138.56864 > 172.217.22.74.443: Flags [P.], seq 1:209, ack 1, win 229, options [nop,nop,TS val 228557 ecr 1092558947], length 208
E...H.@.@..M
......J. ....4=..6............
..|.A. c...........,.$*7.6@..QC..	...m.L....~...e.....**.+./.,.0............./.5.
....**................fonts.googleapis.com.....#..............................................h2.http/1.1uP.........
.
..........::...
09:05:12.674806 IP 10.1.20.138.58647 > 172.217.22.78.443: Flags [P.], seq 1:518, ack 1, win 229, options [nop,nop,TS val 228557 ecr 3748912954], length 517
E..9"5@.@.4.
......N......^................
..|..s.:...........a..c...:..n..<....C.}a..4^..RI.x u{..9kC%...)..or...3.m...A.y)`.a..jj.+./.,.0............./.5.
......................s.ytimg.com.....#...A.7 &..+...k.t..u.Q..V....zD6Rw..&p.|.|.@.,.....b........7.a.s...lqT.n"tx.i.v.^:*@..0e.xT.L....;..g..d.....'........k).K.f.?.e5..S.0...S..)rA~...\H.F..4.0].%-8..6.l..I;d....!....xe.).P.....3,B...U.e..+.....*:.~;..
.)........D..H.*v.M.L.........asxW.-.i..............................................h2.http/1.1uP.........
.
..........jj..................................
09:05:12.675851 IP 172.217.22.67.443 > 10.1.20.138.55452: Flags [P.], seq 161:230, ack 734, win 175, options [nop,nop,TS val 3947802891 ecr 228556], length 69
E..y....;......C
............MP'...........
.N....|.....@........|..G..nqE~(w.H.3kP?..5dj.?2...m.....I.F..m<...s....Y....
09:05:12.678952 IP 172.217.22.67.443 > 10.1.20.138.55448: Flags [P.], seq 4372:4693, ack 464, win 175, options [nop,nop,TS val 1040769864 ecr 228557], length 321
E..uJ...;.Q....C
............ke.....#......
>..H..|.....	...........A.7 &..+...k.t...	...x...^..}a.m.+tq~.........Um
d&.~......V4B "...i..Ix.X&.d#.r....Y....^..u#Qx......8.lr....F..yR7....J....^i>Q.h>'..2....I.4.;6.,.X.c&.tf....T.!O..6.c.9........
..`......g.....`.......\..6..F..........^......P..~r.,....S^..%.A..?|..e.P..........(.........%.(vz.J...a... ...D...
... ....
09:05:12.678956 IP 172.217.22.67.443 > 10.1.20.138.55448: Flags [P.], seq 4693:4762, ack 464, win 175, options [nop,nop,TS val 1040769864 ecr 228557], length 69
E..ya...;.;....C
..........5.ke............
>..H..|.....@........}6.;..Mx...u...#x....z.(G..........r.X....=,.......8....
09:05:12.679759 IP 172.217.22.78.443 > 10.1.20.138.58647: Flags [.], ack 518, win 170, options [nop,nop,TS val 3748912962 ecr 228557], length 0
E..4....;......N
.............`......}.....
.s.B..|.
09:05:12.679765 IP 172.217.22.74.443 > 10.1.20.138.56864: Flags [.], ack 209, win 170, options [nop,nop,TS val 1092558957 ecr 228557], length 0
E..4.E..;......J
...... ..6...5.....>^.....
A. m..|.
09:05:12.680148 IP 172.217.22.78.443 > 10.1.20.138.58647: Flags [P.], seq 1:161, ack 518, win 170, options [nop,nop,TS val 3748912962 ecr 228557], length 160
E.......;......N
.............`.....P......
.s.B..|.....h...d..Z.y........_..F9......h....9..." u{..9kC%...)..or...3.m...A.y)`.a.+...................h2uP..................(..........K....MI~(......../aq@&....n...
09:05:12.680161 IP 10.1.20.138.58647 > 172.217.22.78.443: Flags [.], ack 161, win 237, options [nop,nop,TS val 228559 ecr 3748912962], length 0
E..4"6@.@.6.
......N......`................
..|..s.B
09:05:12.680655 IP 10.1.20.138.58647 > 172.217.22.78.443: Flags [P.], seq 518:734, ack 161, win 237, options [nop,nop,TS val 228559 ecr 3748912962], length 216
E..."7@.@.6.
......N......`................
..|..s.B...................D.i.p.wT..F.a.Qo$.....<kOn.s(T..:B.9/...-..m...O.p.i.!..#...\..	.|.)..t.s.....0...c{/O..(..........Tb...>.......X\.OA...z.Z.ms.p..e...W3..V)!.....B.........(..........o.!.
.......,.5Z.8*.......J.3.
09:05:12.686102 IP 172.217.22.78.443 > 10.1.20.138.58647: Flags [P.], seq 161:230, ack 734, win 175, options [nop,nop,TS val 3748912968 ecr 228559], length 69
E..yM)..;.P....N
.............a............
.s.H..|.....@...........k^..$|.L...."5.b.s..n....X.k.T.b.2.5#-.C/g..C..(.py\j
09:05:12.686406 IP 10.1.20.1.53 > 10.1.20.138.5625: 12363 17/0/0 CNAME youtube-ui.l.google.com., A 172.217.22.110, A 216.58.214.110, A 172.217.16.206, A 172.217.23.174, A 172.217.21.206, A 216.58.205.238, A 172.217.21.238, A 172.217.22.14, A 172.217.18.14, A 172.217.18.174, A 172.217.23.142, A 216.58.206.14, A 216.58.207.78, A 216.58.214.46, A 216.58.214.78, A 172.217.16.174 (323)
E.._;...@...
...
....5...K.50K...........www.youtube.com.............Gi..
youtube-ui.l.google...-.......,.....n.-.......,...:.n.-.......,.......-.......,.......-.......,.......-.......,...:...-.......,.......-.......,.......-.......,.......-.......,.......-.......,.......-.......,...:...-.......,...:.N.-.......,...:...-.......,...:.N.-.......,......
09:05:12.686494 IP 127.0.1.1.53 > 127.0.0.1.33788: 11388 17/0/0 CNAME youtube-ui.l.google.com., A 172.217.22.110, A 216.58.214.110, A 172.217.16.206, A 172.217.23.174, A 172.217.21.206, A 216.58.205.238, A 172.217.21.238, A 172.217.22.14, A 172.217.18.14, A 172.217.18.174, A 172.217.23.142, A 216.58.206.14, A 216.58.207.78, A 216.58.214.46, A 216.58.214.78, A 172.217.16.174 (323)
E.._..@.@............5...K._,|...........www.youtube.com.............Gi..
youtube-ui.l.google...-.......,.....n.-.......,...:.n.-.......,.......-.......,.......-.......,.......-.......,...:...-.......,.......-.......,.......-.......,.......-.......,.......-.......,.......-.......,...:...-.......,...:.N.-.......,...:...-.......,...:.N.-.......,......
